{
  "schema_version": "2.1.0",
  "indicators": [
    {
      "id": "bbands20_middle",
      "type": "BBANDS",
      "params": {
        "period": 20,
        "std": 2
      }
    },
    {
      "id": "rsi14",
      "type": "RSI",
      "params": {
        "period": 14
      }
    },
    {
      "id": "stoch14_k",
      "type": "STOCH",
      "params": {
        "k_period": 14,
        "d_period": 3
      }
    },
    {
      "id": "sma20",
      "type": "SMA",
      "params": {
        "period": 20
      }
    },
    {
      "id": "adx14",
      "type": "ADX",
      "params": {
        "period": 14
      }
    },
    {
      "id": "volume",
      "type": "Volume",
      "params": {
        "window": 20
      }
    },
    {
      "id": "macd12_26_9",
      "type": "MACD",
      "params": {
        "fast": 12,
        "slow": 26,
        "signal": 9
      }
    }
  ],
  "regimes": [
    {
      "id": "mean_reversion_regime",
      "name": "Mean Reversion Market",
      "conditions": {
        "all": [
          {
            "left": {
              "indicator_id": "rsi14",
              "field": "value"
            },
            "op": "between",
            "right": {
              "min": 30.0,
              "max": 70.0
            }
          },
          {
            "left": {
              "indicator_id": "adx14",
              "field": "value"
            },
            "op": "lt",
            "right": {
              "value": 25.0
            }
          }
        ]
      },
      "priority": 10,
      "scope": "entry"
    }
  ],
  "strategies": [
    {
      "id": "sideways_range_bounce",
      "name": "sideways_range_bounce",
      "entry": {
        "all": [
          {
            "left": {
              "indicator_id": "rsi14",
              "field": "value"
            },
            "op": "between",
            "right": {
              "min": 30.0,
              "max": 70.0
            }
          },
          {
            "left": {
              "indicator_id": "adx14",
              "field": "value"
            },
            "op": "lt",
            "right": {
              "value": 25.0
            }
          }
        ]
      },
      "exit": {
        "any": [
          {
            "left": {
              "indicator_id": "rsi14",
              "field": "value"
            },
            "op": "gt",
            "right": {
              "value": 70.0
            }
          },
          {
            "left": {
              "indicator_id": "rsi14",
              "field": "value"
            },
            "op": "lt",
            "right": {
              "value": 30.0
            }
          }
        ]
      },
      "risk": {
        "position_size": 0.02,
        "stop_loss": 0.006,
        "take_profit": 0.06
      }
    }
  ],
  "strategy_sets": [
    {
      "id": "set_sideways_range_bounce",
      "name": "sideways_range_bounce Set",
      "strategies": [
        {
          "strategy_id": "sideways_range_bounce"
        }
      ]
    }
  ],
  "routing": [
    {
      "strategy_set_id": "set_sideways_range_bounce",
      "match": {
        "all_of": [
          "mean_reversion_regime"
        ]
      }
    }
  ],
  "kind": "strategy_config"
}